context,target_word,question,annotated_question,answers,ground_truth_answer,bert-base_pred_orig,bert-base_pred_ambig,bert-large_pred_orig,bert-large_pred_ambig,roberta-base_pred_orig,roberta-base_pred_ambig,roberta-large_pred_orig,roberta-large_pred_ambig,deberta-base_pred_orig,deberta-base_pred_ambig,deberta-large_pred_orig,deberta-large_pred_ambig
"Menzies continued the expanded immigration program established under Chifley, and took important steps towards dismantling the White Australia Policy. In the early 1950s, external affairs minister Percy Spender helped to establish the Colombo Plan for providing economic aid to underdeveloped nations in Australia's region. Under that scheme many future Asian leaders studied in Australia. In 1958 the government replaced the Immigration Act's arbitrarily applied European language dictation test with an entry permit system, that reflected economic and skills criteria. In 1962, Menzies' Commonwealth Electoral Act provided that all Indigenous Australians should have the right to enrol and vote at federal elections (prior to this, indigenous people in Queensland, Western Australia and some in the Northern Territory had been excluded from voting unless they were ex-servicemen). In 1949 the Liberals appointed Dame Enid Lyons as the first woman to serve in an Australian Cabinet. Menzies remained a staunch supporter of links to the monarchy and British Commonwealth but formalised an alliance with the United States and concluded the Agreement on Commerce between Australia and Japan which was signed in July 1957 and launched post-war trade with Japan, beginning a growth of Australian exports of coal, iron ore and mineral resources that would steadily climb until Japan became Australia's largest trading partner.",cabinet,Who was the first women to serve on the Australian Cabinet?,Who was the first woman to be part of the cabinet in Australia?,"{'text': ['Dame Enid Lyons'], 'answer_start': [914]}",['Dame Enid Lyons'],dame enid lyons,dame enid lyons,dame enid lyons,dame enid lyons, Dame Enid Lyons, Dame Enid Lyons, Dame Enid Lyons, Dame Enid Lyons,Dame Enid Lyons,Dame Enid Lyons,Dame Enid Lyons,Dame Enid Lyons
"Some organisms have multiple copies of chromosomes: diploid, triploid, tetraploid and so on. In classical genetics, in a sexually reproducing organism (typically eukarya) the gamete has half the number of chromosomes of the somatic cell and the genome is a full set of chromosomes in a diploid cell. The halving of the genetic material in gametes is accomplished by the segregation of homologous chromosomes during meiosis. In haploid organisms, including cells of bacteria, archaea, and in organelles including mitochondria and chloroplasts, or viruses, that similarly contain genes, the single or set of circular or linear chains of DNA (or RNA for some viruses), likewise constitute the genome. The term genome can be applied specifically to mean what is stored on a complete set of nuclear DNA (i.e., the ""nuclear genome"") but can also be applied to what is stored within organelles that contain their own DNA, as with the ""mitochondrial genome"" or the ""chloroplast genome"". Additionally, the genome can comprise non-chromosomal genetic elements such as viruses, plasmids, and transposable elements.",cell,A gamate has how many chromosomes relative to a somatic cell?,What is count when matched with a regular cell?,"{'text': ['half'], 'answer_start': [186]}",['half'],half,[CLS],half,diploid cell, half,<s>, half,<s>,half,[CLS],half,
"Synapses are the key functional elements of the brain. The essential function of the brain is cell-to-cell communication, and synapses are the points at which communication occurs. The human brain has been estimated to contain approximately 100 trillion synapses; even the brain of a fruit fly contains several million. The functions of these synapses are very diverse: some are excitatory (exciting the target cell); others are inhibitory; others work by activating second messenger systems that change the internal chemistry of their target cells in complex ways. A large number of synapses are dynamically modifiable; that is, they are capable of changing strength in a way that is controlled by the patterns of signals that pass through them. It is widely believed that activity-dependent modification of synapses is the brain's primary mechanism for learning and memory.",cell,A synapse whose purpose is to excite the target cell are called what?,What is a synapse called that stimulates the cell?,"{'text': ['excitatory'], 'answer_start': [379]}",['excitatory'],excitatory,excitatory,excitatory,excitatory, excitatory, excitatory, excitatory, excitatory,excitatory,excitatory,excitatory,excitatory
"After DNA replication is complete, the cell must physically separate the two copies of the genome and divide into two distinct membrane-bound cells.:18.2 In prokaryotes (bacteria and archaea) this usually occurs via a relatively simple process called binary fission, in which each circular genome attaches to the cell membrane and is separated into the daughter cells as the membrane invaginates to split the cytoplasm into two membrane-bound portions. Binary fission is extremely fast compared to the rates of cell division in eukaryotes. Eukaryotic cell division is a more complex process known as the cell cycle; DNA replication occurs during a phase of this cycle known as S phase, whereas the process of segregating chromosomes and splitting the cytoplasm occurs during M phase.:18.1",cell,"Compared to the rates of cell division in eukaryotes, with what speed does binary fission occur?","Compared to division of a cell, how quick is this process occur?","{'text': ['extremely fast'], 'answer_start': [471]}",['extremely fast'],extremely fast,extremely fast,extremely fast,extremely fast, extremely fast, extremely fast, extremely fast,,extremely fast,Binary fission is extremely fast,extremely fast,Binary fission is extremely fast
"The growth, development, and reproduction of organisms relies on cell division, or the process by which a single cell divides into two usually identical daughter cells. This requires first making a duplicate copy of every gene in the genome in a process called DNA replication.:5.2 The copies are made by specialized enzymes known as DNA polymerases, which ""read"" one strand of the double-helical DNA, known as the template strand, and synthesize a new complementary strand. Because the DNA double helix is held together by base pairing, the sequence of one strand completely specifies the sequence of its complement; hence only one strand needs to be read by the enzyme to produce a faithful copy. The process of DNA replication is semiconservative; that is, the copy of the genome inherited by each daughter cell contains one original and one newly synthesized strand of DNA.:5.2",cell,"In cell division, what two cells are created?","In cell division, what two cells are created?","{'text': ['identical daughter cells'], 'answer_start': [143]}",['identical daughter cells'],identical daughter cells,identical daughter cells,identical daughter cells,identical daughter cells, daughter cells, daughter cells, identical daughter cells, identical daughter cells,identical daughter cells,identical daughter cells,identical daughter cells,identical daughter cells
"In the last two decades, photovoltaics (PV), also known as solar PV, has evolved from a pure niche market of small scale applications towards becoming a mainstream electricity source. A solar cell is a device that converts light directly into electricity using the photoelectric effect. The first solar cell was constructed by Charles Fritts in the 1880s. In 1931 a German engineer, Dr Bruno Lange, developed a photo cell using silver selenide in place of copper oxide. Although the prototype selenium cells converted less than 1% of incident light into electricity, both Ernst Werner von Siemens and James Clerk Maxwell recognized the importance of this discovery. Following the work of Russell Ohl in the 1940s, researchers Gerald Pearson, Calvin Fuller and Daryl Chapin created the crystalline silicon solar cell in 1954. These early solar cells cost 286 USD/watt and reached efficiencies of 4.5–6%. By 2012 available efficiencies exceed 20% and the maximum efficiency of research photovoltaics is over 40%.",cell,"In the 1880s, who constructed the first solar cell?","In the 1880s, who constructed the first cell?","{'text': ['Charles Fritts'], 'answer_start': [327]}",['Charles Fritts'],charles fritts,charles fritts,charles fritts,charles fritts, Charles Fritts, Charles Fritts, Charles Fritts, Charles Fritts,Charles Fritts,Charles Fritts,Charles Fritts,Charles Fritts
"The duplication and transmission of genetic material from one generation of cells to the next is the basis for molecular inheritance, and the link between the classical and molecular pictures of genes. Organisms inherit the characteristics of their parents because the cells of the offspring contain copies of the genes in their parents' cells. In asexually reproducing organisms, the offspring will be a genetic copy or clone of the parent organism. In sexually reproducing organisms, a specialized form of cell division called meiosis produces cells called gametes or germ cells that are haploid, or contain only one copy of each gene.:20.2 The gametes produced by females are called eggs or ova, and those produced by males are called sperm. Two gametes fuse to form a diploid fertilized egg, a single cell that has two sets of genes, with one copy of each gene from the mother and one from the father.:20",cell,In what type of organism will a specialized form of cell division called meiosis produce cells called gametes?,What kind of organism carries out this type of division in cell?,"{'text': ['In sexually reproducing organisms'], 'answer_start': [451]}",['In sexually reproducing organisms'],sexually reproducing organisms,meiosis,sexually reproducing organisms,sexually reproducing, sexually reproducing, sexually reproducing, sexually reproducing organisms, sexually reproducing organisms,In sexually reproducing organisms,In sexually reproducing organisms,sexually reproducing organisms,sexually reproducing organisms
"In the last two decades, photovoltaics (PV), also known as solar PV, has evolved from a pure niche market of small scale applications towards becoming a mainstream electricity source. A solar cell is a device that converts light directly into electricity using the photoelectric effect. The first solar cell was constructed by Charles Fritts in the 1880s. In 1931 a German engineer, Dr Bruno Lange, developed a photo cell using silver selenide in place of copper oxide. Although the prototype selenium cells converted less than 1% of incident light into electricity, both Ernst Werner von Siemens and James Clerk Maxwell recognized the importance of this discovery. Following the work of Russell Ohl in the 1940s, researchers Gerald Pearson, Calvin Fuller and Daryl Chapin created the crystalline silicon solar cell in 1954. These early solar cells cost 286 USD/watt and reached efficiencies of 4.5–6%. By 2012 available efficiencies exceed 20% and the maximum efficiency of research photovoltaics is over 40%.",cell,In what year was the crystalline silicon solar cell constructed?,In what year was the cell constructed?,"{'text': ['1954'], 'answer_start': [819]}",['1954'],1954,1880s,1954,1880s, 1954, 1880s, 1954, 1931,1954,[CLS],1954,1880s
"Axons transmit signals to other neurons by means of specialized junctions called synapses. A single axon may make as many as several thousand synaptic connections with other cells. When an action potential, traveling along an axon, arrives at a synapse, it causes a chemical called a neurotransmitter to be released. The neurotransmitter binds to receptor molecules in the membrane of the target cell.",cell,The neurotansmitter binds to what of a target cell?,The signal connects to what part of the target cell?,"{'text': ['receptor molecules'], 'answer_start': [347]}",['receptor molecules'],receptor molecules,membrane,receptor molecules,receptor molecules in the membrane, receptor molecules, membrane, receptor molecules, receptor molecules in the membrane,receptor molecules,receptor molecules in the membrane,receptor molecules,the membrane
"Genes are regulated so that they are expressed only when the product is needed, since expression draws on limited resources.:7 A cell regulates its gene expression depending on its external environment (e.g. available nutrients, temperature and other stresses), its internal environment (e.g. cell division cycle, metabolism, infection status), and its specific role if in a multicellular organism. Gene expression can be regulated at any step: from transcriptional initiation, to RNA processing, to post-translational modification of the protein. The regulation of lactose metabolism genes in E. coli (lac operon) was the first such mechanism to be described in 1961.",cell,What are examples of a cell's external environment?,What are the things outside the cell?,"{'text': ['available nutrients, temperature and other stresses'], 'answer_start': [208]}","['available nutrients, temperature and other stresses']","available nutrients, temperature and other stresses","available nutrients, temperature and other stresses","available nutrients , temperature and other stresses","available nutrients , temperature and other stresses"," available nutrients, temperature and other stresses",<s>," available nutrients, temperature and other stresses"," available nutrients, temperature and other stresses","available nutrients, temperature and other stresses",external environment,"available nutrients, temperature and other stresses","available nutrients, temperature and other stresses"
"Genes are regulated so that they are expressed only when the product is needed, since expression draws on limited resources.:7 A cell regulates its gene expression depending on its external environment (e.g. available nutrients, temperature and other stresses), its internal environment (e.g. cell division cycle, metabolism, infection status), and its specific role if in a multicellular organism. Gene expression can be regulated at any step: from transcriptional initiation, to RNA processing, to post-translational modification of the protein. The regulation of lactose metabolism genes in E. coli (lac operon) was the first such mechanism to be described in 1961.",cell,What are examples of a cell's internal environment?,What are the things inside the cell?,"{'text': ['cell division cycle, metabolism, infection status'], 'answer_start': [293]}","['cell division cycle, metabolism, infection status']","cell division cycle, metabolism, infection status","available nutrients, temperature and other stresses","cell division cycle , metabolism , infection status","cell division cycle , metabolism , infection status"," cell division cycle, metabolism, infection status"," cell division cycle, metabolism, infection status"," cell division cycle, metabolism, infection status"," cell division cycle, metabolism, infection status","cell division cycle, metabolism, infection status","cell division cycle, metabolism, infection status","cell division cycle, metabolism, infection status","cell division cycle, metabolism, infection status"
"In the last two decades, photovoltaics (PV), also known as solar PV, has evolved from a pure niche market of small scale applications towards becoming a mainstream electricity source. A solar cell is a device that converts light directly into electricity using the photoelectric effect. The first solar cell was constructed by Charles Fritts in the 1880s. In 1931 a German engineer, Dr Bruno Lange, developed a photo cell using silver selenide in place of copper oxide. Although the prototype selenium cells converted less than 1% of incident light into electricity, both Ernst Werner von Siemens and James Clerk Maxwell recognized the importance of this discovery. Following the work of Russell Ohl in the 1940s, researchers Gerald Pearson, Calvin Fuller and Daryl Chapin created the crystalline silicon solar cell in 1954. These early solar cells cost 286 USD/watt and reached efficiencies of 4.5–6%. By 2012 available efficiencies exceed 20% and the maximum efficiency of research photovoltaics is over 40%.",cell,What is a solar cell?,What is a cell?,"{'text': ['a device that converts light directly into electricity'], 'answer_start': [200]}",['a device that converts light directly into electricity'],a device that converts light directly into electricity,a device that converts light directly into electricity,a device that converts light directly into electricity using the photoelectric effect,a device that converts light directly into electricity using the photoelectric effect, a device that converts light directly into electricity using the photoelectric effect, a device that converts light directly into electricity using the photoelectric effect, a device that converts light directly into electricity, a device that converts light directly into electricity,a device that converts light directly into electricity,a device that converts light directly into electricity,a device that converts light directly into electricity using the photoelectric effect,[CLS]
"After DNA replication is complete, the cell must physically separate the two copies of the genome and divide into two distinct membrane-bound cells.:18.2 In prokaryotes (bacteria and archaea) this usually occurs via a relatively simple process called binary fission, in which each circular genome attaches to the cell membrane and is separated into the daughter cells as the membrane invaginates to split the cytoplasm into two membrane-bound portions. Binary fission is extremely fast compared to the rates of cell division in eukaryotes. Eukaryotic cell division is a more complex process known as the cell cycle; DNA replication occurs during a phase of this cycle known as S phase, whereas the process of segregating chromosomes and splitting the cytoplasm occurs during M phase.:18.1",cell,What is another thing the cell must do once DNA replication is complete?,What should be done in a cell once the process is complete?,"{'text': ['divide into two distinct membrane-bound cells'], 'answer_start': [102]}",['divide into two distinct membrane-bound cells'],physically separate the two copies of the genome and divide into two distinct membrane - bound cells,physically separate the two copies of the genome and divide into two distinct membrane - bound cells,divide into two distinct membrane - bound cells,physically separate the two copies of the genome and divide into two distinct membrane - bound cells, physically separate the two copies of the genome and divide into two distinct membrane-bound cells, physically separate the two copies of the genome and divide into two distinct membrane-bound cells, divide into two distinct membrane-bound cells, divide into two distinct membrane-bound cells,divide into two distinct membrane-bound cells,divide into two distinct membrane-bound cells,divide into two distinct membrane-bound cells,physically separate the two copies of the genome and divide into two distinct membrane-bound cells
"During mutualistic symbioses, the host cell lacks some of the nutrients, which are provided by the endosymbiont. As a result, the host favors endosymbiont's growth processes within itself by producing some specialized cells. These cells affect the genetic composition of the host in order to regulate the increasing population of the endosymbionts and ensuring that these genetic changes are passed onto the offspring via vertical transmission (heredity).",cell,What is given to the host cell?,What is given to the host cell?,"{'text': ['nutrients'], 'answer_start': [62]}",['nutrients'],nutrients,nutrients,nutrients,nutrients,<s>,<s>, nutrients, nutrients,nutrients,nutrients,nutrients,nutrients
"After DNA replication is complete, the cell must physically separate the two copies of the genome and divide into two distinct membrane-bound cells.:18.2 In prokaryotes (bacteria and archaea) this usually occurs via a relatively simple process called binary fission, in which each circular genome attaches to the cell membrane and is separated into the daughter cells as the membrane invaginates to split the cytoplasm into two membrane-bound portions. Binary fission is extremely fast compared to the rates of cell division in eukaryotes. Eukaryotic cell division is a more complex process known as the cell cycle; DNA replication occurs during a phase of this cycle known as S phase, whereas the process of segregating chromosomes and splitting the cytoplasm occurs during M phase.:18.1",cell,What is one thing the cell must do once DNA replication is compete?,What is the function of a cell when the preocess is complete?,"{'text': ['physically separate the two copies of the genome'], 'answer_start': [49]}",['physically separate the two copies of the genome'],physically separate the two copies of the genome and divide into two distinct membrane - bound cells,physically separate the two copies of the genome and divide into two distinct membrane - bound cells,physically separate the two copies of the genome and divide into two distinct membrane - bound cells,divide into two distinct membrane - bound cells, physically separate the two copies of the genome and divide into two distinct membrane-bound cells, physically separate the two copies of the genome and divide into two distinct membrane-bound cells, physically separate the two copies of the genome and divide into two distinct membrane-bound cells,"<s>What is the function of a cell when the preocess is complete?</s></s>After DNA replication is complete, the cell must physically separate the two copies of the genome and divide into two distinct membrane-bound cells",physically separate the two copies of the genome,divide into two distinct membrane-bound cells,physically separate the two copies of the genome,divide into two distinct membrane-bound cells
"The total complement of genes in an organism or cell is known as its genome, which may be stored on one or more chromosomes. A chromosome consists of a single, very long DNA helix on which thousands of genes are encoded.:4.2 The region of the chromosome at which a particular gene is located is called its locus. Each locus contains one allele of a gene; however, members of a population may have different alleles at the locus, each with a slightly different gene sequence.",cell,What is the total complement of genes in an organism or cell known as?,What is the total complement of items in a cell known as?,"{'text': ['its genome'], 'answer_start': [65]}",['its genome'],its genome,its genome,its genome,its genome, its genome,<s>, its genome, its genome,its genome,genome,its genome,[CLS]
"Housekeeping genes are critical for carrying out basic cell functions and so are expressed at a relatively constant level (constitutively). Since their expression is constant, housekeeping genes are used as experimental controls when analysing gene expression. Not all essential genes are housekeeping genes since some essential genes are developmentally regulated or expressed at certain times during the organism's life cycle.",cell,What type of genes are necessary for performing basic cell functions?,What type of items are necessary for the process in a cell?,"{'text': ['Housekeeping genes'], 'answer_start': [0]}",['Housekeeping genes'],housekeeping genes,housekeeping genes,housekeeping genes,housekeeping genes,Housekeeping genes,Housekeeping genes,Housekeeping genes,Housekeeping genes,Housekeeping genes,Housekeeping genes,Housekeeping genes,Housekeeping genes
"In prokaryotes, transcription occurs in the cytoplasm; for very long transcripts, translation may begin at the 5' end of the RNA while the 3' end is still being transcribed. In eukaryotes, transcription occurs in the nucleus, where the cell's DNA is stored. The RNA molecule produced by the polymerase is known as the primary transcript and undergoes post-transcriptional modifications before being exported to the cytoplasm for translation. One of the modifications performed is the splicing of introns which are sequences in the transcribed region that do not encode protein. Alternative splicing mechanisms can result in mature transcripts from the same gene having different sequences and thus coding for different proteins. This is a major form of regulation in eukaryotic cells and also occurs in some prokaryotes.:7.5",cell,Where does a eukaryote store the cell's DNA?,Where does a life form store the items in a cell?,"{'text': ['in the nucleus'], 'answer_start': [210]}",['in the nucleus'],in the nucleus,the nucleus,the nucleus,the nucleus, the nucleus,<s>, in the nucleus, the nucleus,in the nucleus,"in the nucleus, where the cell's DNA is stored. The RNA molecule produced by the polymerase is known as the primary transcript and undergoes post-transcriptional modifications before being exported to the cytoplasm",the nucleus,the nucleus
